{
  "format": "botwork-report",
  "version": 1,
  "complete": true,
  "mode": "suites",
  "started_at": "2026-10-01T18:30:27.904816Z",
  "finished_at": "2026-10-01T18:30:28.150652Z",
  "duration_us": 245730,
  "exit_code": 1,
  "verdict": {
    "status": "failed",
    "complete": true,
    "cases": {
      "total": 2,
      "succeeded": 1,
      "expected_failure": 0,
      "failed": 1,
      "unexpected_pass": 0,
      "skipped": 0,
      "cancelled": 0,
      "timed_out": 0,
      "limit_exceeded": 0,
      "interrupted": 0
    },
    "fixture_failures": 0,
    "delivery": "complete"
  },
  "runs": [
    {
      "number": 1,
      "format": "botwork-run",
      "version": 1,
      "identity": {
        "id": "compat/passes",
        "name": "A passing case",
        "dataset": null,
        "row": null
      },
      "status": "succeeded",
      "complete": true,
      "skip_reason": null,
      "started_at": "2026-10-01T18:30:28.137372Z",
      "finished_at": "2026-10-01T18:30:28.141496Z",
      "duration_us": 4123,
      "statements": [
        {
          "index": 0,
          "kind": "call",
          "location": {
            "file": "compat.suite.botwork",
            "start_byte": 197,
            "end_byte": 210,
            "line": 4,
            "column": 9,
            "end_line": 4,
            "end_column": 22
          },
          "offset_us": 3490,
          "duration_us": 590,
          "status": "succeeded",
          "code": null
        }
      ],
      "omitted_statements": 0,
      "logs": [
        {
          "statement": 0,
          "offset_us": 3706,
          "bytes": 5,
          "text": "hello",
          "truncated": false
        }
      ],
      "omitted_logs": 0,
      "logged_bytes": 5,
      "error": null,
      "artifacts": [],
      "omitted_artifacts": 0,
      "events": 5
    },
    {
      "number": 2,
      "format": "botwork-run",
      "version": 1,
      "identity": {
        "id": "compat/fails",
        "name": "A failing case",
        "dataset": null,
        "row": null
      },
      "status": "failed",
      "complete": true,
      "skip_reason": null,
      "started_at": "2026-10-01T18:30:28.137583Z",
      "finished_at": "2026-10-01T18:30:28.141384Z",
      "duration_us": 3801,
      "statements": [
        {
          "index": 0,
          "kind": "assignment",
          "location": {
            "file": "compat.suite.botwork",
            "start_byte": 271,
            "end_byte": 284,
            "line": 7,
            "column": 9,
            "end_line": 7,
            "end_column": 22
          },
          "offset_us": 3478,
          "duration_us": 68,
          "status": "succeeded",
          "code": null
        },
        {
          "index": 1,
          "kind": "call",
          "location": {
            "file": "compat.suite.botwork",
            "start_byte": 293,
            "end_byte": 318,
            "line": 8,
            "column": 9,
            "end_line": 8,
            "end_column": 34
          },
          "offset_us": 3567,
          "duration_us": 135,
          "status": "failed",
          "code": "BW9001"
        }
      ],
      "omitted_statements": 0,
      "logs": [],
      "omitted_logs": 0,
      "logged_bytes": 0,
      "error": {
        "code": "BW9001",
        "status": "failed",
        "message": "Assertion failed: Expected 2 (Int), got 1 (Int)\n  difference at $: expected 2 (Int), got 1 (Int)\n  full operands: details.expected / details.actual (typed JSON)",
        "truncated": false,
        "location": {
          "file": "compat.suite.botwork",
          "start_byte": 293,
          "end_byte": 318,
          "line": 8,
          "column": 9,
          "end_line": 8,
          "end_column": 34
        },
        "causes": [],
        "omitted_causes": 0
      },
      "artifacts": [],
      "omitted_artifacts": 0,
      "events": 6
    }
  ],
  "omitted_run_details": 0,
  "fixtures": []
}
